表單簽核流程,日期,EPA,病歷號,個案姓名,診斷,信賴程度（學員自評）,EPA2門診/社區衛教 信賴程度,教師給學員回饋,教師給CCC回饋（僅CCC委員可讀，對學員隱藏）,1:教師在旁逐步共同操作2:教師在旁必要時協助   3.教師事後重點確認            4.必要時知會教師確認    5.獨立執行,,,,
楊惠芳,2024-08-29,02門診/社區衛教,,,,,2,,,,,,,
方文輝,2024-09-11,02門診/社區衛教,,,,,3,,,,,,,
張玄穎/DOC12013(2025-03-07 18:34) → 孫于珊/DOC10685(2025-03-10 13:44),2025-03-06,02門診/社區衛教,9080873,楊時實, One 0.2 cm polyp without stalk at 50 cm above anal verge. Removed ,5,4,可學習以病人為中心的照護模式，在為病人作決定前，必須先了解病人的需求及了解他們的環境，包括家庭成員、 生活事件、家人互動關係、工作及文化背景等；也要告知並分享醫療決策、提昇病人對疾病 及預防性行為之自我照顧的醫療知識與技巧。更具體的說，就是在疾病治療的整個過程中， 由了解病人對罹患之疾病的知識與信念開始，進而知道其對疾病治療的期望，再共同討論出 有明確目標及執行策略之治療計劃，同時提供病人自我照顧能力的訓練與支持。,,,,,,
張玄穎/DOC12013(2025-04-01 13:55) → 吳立偉/liweiwu(2025-04-02 13:09),2025-04-01,02門診/社區衛教,2462718,林金山,"One 0.4 cm polyp at 50cm above anal verge, polypectomy NOT done.",5,5,學員講解流暢，但解釋過程話語速度可稍微放慢，注意衛教重點與溝通技巧。,學員學習主動積極，態度良好且具備相關臨床衛教能力。,,,,,
張玄穎/DOC12013(2025-04-11 15:51) → 林育任/doc10789(2025-04-15 00:41),2025-04-11,02門診/社區衛教,2061701,鄭富聰,"GERD, grade A",5,5,對於胃食道逆流的基礎知識，治療與衛教已十分熟練，今後宜選擇其他疾病做評核,對於胃食道逆流的基礎知識，治療與衛教已十分熟練,,,,,
