表單簽核流程,日期,EPA,病歷號,個案姓名,診斷,信賴程度（學員自評）,EPA7慢性照護 信賴程度,教師給學員回饋,教師給CCC回饋（僅CCC委員可讀，對學員隱藏）,1:教師在旁逐步共同操作2:教師在旁必要時協助   3.教師事後重點確認            4.必要時知會教師確認    5.獨立執行,,,,
內科,2024-10-29,07.慢病照護,,,,,4,,,,,,,
婦產許博超,2024-12-25,07.慢病照護,90***66,郭*枝,Papilary serous carcinoma of bilateral ovaries,X,4,可獨立執行化療前評估,,,,,,
婦產許博超,2024-12-27,07.慢病照護,20***69,林*敏,Synchronous high grade serous carcinoma of left fallopian tube,X,4,可獨立執行化療前評估,,,,,,
張玄穎/DOC12013(2025-04-01 16:44) → 王富民/m86010442(2025-04-01 16:45),2025-02-04,07.慢病照護,3396195,葉鈞瑋,Stage IV lymphoblastic B-cell lymphoma,3,4,透過EPA的評估，針對病童的病史詢問、身體檢查、撰寫病歷紀錄，並學習治療與評估，相信玄穎醫師在這段時間對於兒科疾病的治療已有不少心得與收穫，請繼續保持此學習熱忱。,,,,,,
張玄穎/DOC12013(2025-03-26 11:50) → 王富民/m86010442(2025-04-01 16:43),2025-02-14,07.慢病照護,9061976,許宇彤,Precursor B lymphoblastic leukemia,4,4,透過EPA的評估，針對leukemia病童的病史詢問、身體檢查、撰寫病歷紀錄，並學習治療與評估，相信張醫師在這段時間對於兒科疾病的治療已有不少心得與收穫。,張醫師能主動學習並具備極佳之病童照顧能力。其態度能表現出正直謙遜，表現不俗。,,,,,
張玄穎/DOC12013(2025-04-28 14:30) → 吳立偉/liweiwu(2025-04-30 13:15),2025-04-08,07慢病照護,9084862,黃宜俊,"dyslipidemia(LDL176, HDL43)",5,5,建議學員在衛教病患前須先將病患所有資料整合與依照重要性解釋與溝通，避免溝通不良與糾紛。,學員學習主動積極，態度良好且具備相關臨床衛教能力。,,,,,
張玄穎/DOC12013(2025-08-29 09:48) → 陳田育/verducci(2025-09-20 14:36),2025-07-11,07慢病照護,9063069,沈明澤,adjustment reaction,4,4,對於病史詢問及評估之執行確實、病歷記載清楚詳實。不知道專業知識或診斷及治療處置，可尋求老師的指導。,學員於精神科初診問診主動且具備基本精神科門診會談技巧。,,,,,
張玄穎/DOC12013(2025-08-29 09:48) → 陳田育/verducci(2025-09-20 14:35),2025-07-18,07慢病照護,1826762,王栭壽,sleep apnea,4,4,對於病史詢問及評估之執行確實、病歷記載清楚詳實。不知道專業知識或診斷及治療處置，可尋求老師的指導。,學員於精神科初診問診主動且具備基本精神科門診會談技巧，對於病史詢問及評估之執行確實、病歷記載清楚詳實。,,,,,
