表單簽核流程,日期,EPA,病歷號,個案姓名,診斷,信賴程度（學員自評）,EPA10出院準備 信賴程度,教師給學員回饋,教師給CCC回饋（僅CCC委員可讀，對學員隱藏）,1:教師在旁逐步共同操作2:教師在旁必要時協助   3.教師是後重點確認            4.必要時知會教師確認    5.獨立執行,,,,
內科,2024-09-27,10.出院準備,,,,,3,,,,,,,
內科,2024-09-27,10.出院準備,,,,,3,,,,,,,
徐呈祥/DOC12001(2025-05-08 13:24) → 周琰璉/L123320452(2025-05-27 08:29),2025-04-28,10出院準備/照護轉銜,9091211,鄭孟僖,"Ischemic cardiomyopathy and heart failure with reduced EF: 20-25%, NYHA FC III to IV, stage B, precipitated by sepsis",3,4,"學員知道該怎麼做嗎？是否有足夠的背景知識？
足夠

是否意識到任務的風險和可能的併發症？
可以

如果遇到特殊病人狀況，發生風險或併發症時你會怎麼做？」或可直接問「你不知道該做什麼時，你會怎麼做？」
會適度反映狀況，尋求協助

認真學習，繼續保持",認真學習，繼續保持,,,,,
徐呈祥/DOC12001(2025-05-29 13:08) → 胡智棻/caperhu(2025-07-04 11:39),2025-05-15,10出院準備/照護轉銜,9095014,蔡勉甫,"*. Seizure with disturbance consciousness, cause to be determined, suspected acute encephalitis.",3,3,"抽筋個案的出院前衛教很重要, 希望家屬能在第一時間做好處理, 減少缺氧或是受傷風險, ","需要花一點時間跟家屬衛教, 也要能回答很多預後問題, 很不容易, 也需要長期追蹤才能有比較明確的判斷.",,,,,
