表單簽核流程,日期,EPA,病歷號,個案姓名,診斷,信賴程度（學員自評）,EPA5健康檢查 信賴程度,教師給學員回饋,教師給CCC回饋（僅CCC委員可讀，對學員隱藏）,1:教師在旁逐步共同操作2:教師在旁必要時協助   3.教師事後重點確認            4.必要時知會教師確認    5.獨立執行,,,,
彭道鈞,2024-10-16,05.健康檢查,,,,,4,,,,,,,
孫于珊,2024-10-17,05.健康檢查,,,,,3,,,,,,,
徐呈祥/DOC12001(2025-03-03 13:59) → 謝國祥/hkh717,2025-02-25,05.健康檢查,9014307,陳語希,for regular JE-CV_LiveAtd1 vaccination,3,4,能了解生長、發展重點、各疫苗接種時程，活化與不活化疫苗種類與注意事項，若之前接受過IVIG，哪些疫苗要延後等。,學習主動、有責任感、具備兒童生長、發展知識等,,,,,
徐呈祥/DOC12001(2025-07-04 15:24) → 方文輝/DOC30467(2025-08-05 14:29),2025-06-23,05健康檢查,1699785,陳冠志,for regular check-up,3,4,建議將可以將健檢有異常的部分寫出在診斷中，以利後續評核。,,,,,,
徐呈祥/DOC12001(2025-07-04 15:23) → 方文輝/DOC30467(2025-08-05 14:24),2025-06-30,05健康檢查,2305313,袁秀玉,for regular check-up,3,4,建議診斷可以再寫明確一點，以利後續評核。,,,,,,
